{
  "task_id": "22222222-2222-2222-2222-222222222222",
  "run_id": "11111111-1111-1111-1111-111111111111",
  "title": "fixture-driven dry run",
  "repo": { "url": "https://github.com/kgsmith19/hyperbolic-core", "ref": "main" },
  "harness": { "preferred": "claude-code", "fallback": ["claude-code"] },
  "autonomy": 0,
  "prompt": { "objective": "prove the CLI submits a pre-built contract", "context_refs": [], "prompt_org_refs": [] },
  "constraints": {
    "allowed_paths": ["**"],
    "denied_paths": [],
    "vault_keys": [],
    "max_turns": 40,
    "wall_clock_min": 60,
    "token_budget": 500000,
    "network": "provider-only"
  },
  "acceptance": [],
  "deliverable": { "type": "commit", "branch": "brain/22222222-2222-2222-2222-222222222222", "push": false, "draft_pr": false }
}
